{
  "id": "prt_demo",
  "message_id": "msg_demo",
  "session_id": "ses_demo",
  "time_created": 1789041600000,
  "data": "{\"id\": \"prt_demo\", \"sessionID\": \"ses_demo\", \"messageID\": \"msg_demo\", \"type\": \"tool\", \"tool\": \"bash\", \"state\": {\"status\": \"completed\", \"input\": {\"command\": \"pnpm test parser\"}, \"output\": \"All tests passed.\", \"metadata\": {\"exit\": 0}}}"
}
